{
  "$schema": "https://json-schema.org/draft/2020-12/schema",
  "title": "HandStartedMessage",
  "description": "State event: a new hand was dealt. Each receiver sees only their own hole cards. Always about one hand, so hand_id is never null.",
  "type": "object",
  "properties": {
    "protocol_version": {
      "$ref": "../common.schema.json#/$defs/ProtocolVersion"
    },
    "type": {
      "const": "hand.started"
    },
    "room_id": {
      "$ref": "../common.schema.json#/$defs/RoomId"
    },
    "hand_id": {
      "$ref": "../common.schema.json#/$defs/HandId"
    },
    "version": {
      "$ref": "../common.schema.json#/$defs/Version"
    },
    "server_time": {
      "$ref": "../common.schema.json#/$defs/ServerTime"
    },
    "payload": {
      "type": "object",
      "properties": {
        "hand": {
          "$ref": "../common.schema.json#/$defs/HandView"
        }
      },
      "required": [
        "hand"
      ],
      "additionalProperties": false
    }
  },
  "required": [
    "protocol_version",
    "type",
    "room_id",
    "hand_id",
    "version",
    "server_time",
    "payload"
  ],
  "additionalProperties": false
}
